{
  "chunk": "ch05-a",
  "chapter": 5,
  "dataVersion": "2.0",
  "questions": [
    {
      "id": "ctai-0053",
      "revision": 1,
      "syllabusVersion": "2.0",
      "chapter": 5,
      "section": "5.1",
      "syllabusRef": "§5.1.1",
      "objectives": [
        "AI-5.1.1"
      ],
      "kLevel": "K2",
      "type": "single",
      "selectCount": 1,
      "points": 1,
      "difficulty": 2,
      "tags": [
        "input-data",
        "risk-mitigation",
        "data-provenance"
      ],
      "origin": "original",
      "status": "published",
      "correct": [
        "a"
      ],
      "media": null,
      "meta": {
        "author": "claude",
        "reviewedBy": "question-verifier (two adversarial passes, 2026-10-02; CT-AI v2.0 F4-01 — every key re-derived from the v2.0 syllabus, ctai-0041 key corrected to c, length cues cleared both ways, K3 items checked as applications)",
        "createdAt": "2026-10-02",
        "updatedAt": "2026-10-02"
      },
      "i18n": {
        "tr": {
          "stem": "Bir ekip, toplama yöntemleri belgelenmemiş bir üçüncü taraf veri aracısından satın aldığı veri setiyle bir makine öğrenimi (MÖ) modeli eğitmeyi planlıyor. Ekip verinin güvenilmez bir kaynaktan geldiğinden endişeleniyor. Müfredata göre bu riski azaltmak için hangi test yaklaşımı kullanılabilir?",
          "options": [
            {
              "id": "a",
              "text": "Veri kaynağı izlenebilirliği testi (data provenance testing)"
            },
            {
              "id": "b",
              "text": "Veri seti kısıt testi (dataset constraint testing)"
            },
            {
              "id": "c",
              "text": "Veri temsil ediciliği testi (data representativeness testing)"
            },
            {
              "id": "d",
              "text": "Öznitelik testi (feature testing)"
            }
          ],
          "rationale": {
            "summary": "Güvenilmez kaynaklardan edinilen eğitim verisi, kötü yönetilen veri ve zehirlenmiş eğitim verisi riskleri için müfredat veri kaynağı izlenebilirliği testini (data provenance testing) olası risk azaltma olarak listeler. Diğer üç yaklaşım başka risklere karşılık gelir.",
            "byOption": {
              "a": "Doğru. Veri kaynağı izlenebilirliği testi, verinin nereden geldiğini ve nasıl yönetildiğini sınar; güvenilmez kaynak riskine karşılık gelen azaltmadır.",
              "b": "Yanlış. Veri seti kısıt testi, kendi içinde tutarsız veri setlerini, aralık dışı değerleri ve yanlış veri türlerini hedefler; verinin kaynağının güvenilirliğini sınamaz.",
              "c": "Yanlış. Veri temsil ediciliği testi dengesiz, çarpık veya eksik veri ve kullanım durumlarının yalnızca bir alt kümesine odaklanan veri gibi risklere karşılık gelir; verinin işletim verisini ne kadar yansıttığını sınar, kaynağın güvenilirliğini sınamaz.",
              "d": "Yanlış. Öznitelik testi, en uygun olmayan öznitelik seçimi riskine karşılık gelir; verinin kaynağıyla değil, modelin hangi öznitelikleri kullandığıyla ilgilidir."
            }
          }
        },
        "en": {
          "stem": "A team plans to train a machine learning (ML) model on a dataset bought from a third-party data broker whose collection methods are undocumented. The team worries that the data comes from an untrustworthy source. According to the syllabus, which test approach could be used to mitigate this risk?",
          "options": [
            {
              "id": "a",
              "text": "Data provenance testing"
            },
            {
              "id": "b",
              "text": "Dataset constraint testing"
            },
            {
              "id": "c",
              "text": "Data representativeness testing"
            },
            {
              "id": "d",
              "text": "Feature testing"
            }
          ],
          "rationale": {
            "summary": "For training data acquired from untrustworthy sources, poorly managed data and poisoned training data, the syllabus lists data provenance testing as a possible risk mitigation. The other three approaches map to different risks.",
            "byOption": {
              "a": "Correct. Data provenance testing examines where the data came from and how it was managed, which is the mitigation paired with the untrustworthy-source risk.",
              "b": "Incorrect. Dataset constraint testing targets internally inconsistent datasets, out-of-range data and wrong data types; it does not assess how trustworthy the source of the data is.",
              "c": "Incorrect. Data representativeness testing maps to risks such as imbalanced, skewed or missing data and data focused on a subset of use cases; it checks how closely the data reflects operational data, not how trustworthy its source is.",
              "d": "Incorrect. Feature testing maps to sub-optimal feature selection; it concerns which features the model uses, not where the data came from."
            }
          }
        }
      }
    },
    {
      "id": "ctai-0054",
      "revision": 1,
      "syllabusVersion": "2.0",
      "chapter": 5,
      "section": "5.1",
      "syllabusRef": "§5.1.1",
      "objectives": [
        "AI-5.1.1"
      ],
      "kLevel": "K2",
      "type": "single",
      "selectCount": 1,
      "points": 1,
      "difficulty": 3,
      "tags": [
        "input-data",
        "risk-mitigation"
      ],
      "origin": "original",
      "status": "published",
      "correct": [
        "c"
      ],
      "media": null,
      "meta": {
        "author": "claude",
        "reviewedBy": "question-verifier (two adversarial passes, 2026-10-02; CT-AI v2.0 F4-01 — every key re-derived from the v2.0 syllabus, ctai-0041 key corrected to c, length cues cleared both ways, K3 items checked as applications)",
        "createdAt": "2026-10-02",
        "updatedAt": "2026-10-02"
      },
      "i18n": {
        "tr": {
          "stem": "Aşağıdakilerden hangisi, bir girdi verisi riskini müfredatın girdi verisi riskleri tablosunda onunla eşleştirilen test yaklaşımıyla doğru biçimde eşleştirir?",
          "options": [
            {
              "id": "a",
              "text": "Kendi içinde tutarsız veri seti: veri temsil ediciliği testi"
            },
            {
              "id": "b",
              "text": "Veri hattının güvenlik ihlalleri veya kontrolsüz değişikliklerden etkilenmesi: veri seti kısıt testi"
            },
            {
              "id": "c",
              "text": "Yanlış veya tutarsız etiketlere yol açan zayıf etiketleme: etiket doğruluğu testi"
            },
            {
              "id": "d",
              "text": "Eğitim verisindeki hatalardan kaynaklanan yanlılık: veri kaynağı izlenebilirliği testi"
            }
          ],
          "rationale": {
            "summary": "Tabloda zayıf etiketleme yönergeleri ve zayıf etiketleme etiket doğruluğu testiyle eşleşir. Diğer üç seçenekte risk, başka bir risk için listelenen yaklaşımla eşleştirilmiştir.",
            "byOption": {
              "a": "Yanlış. Kendi içinde tutarsız veri seti için tablodaki karşılık veri seti kısıt testidir; veri temsil ediciliği testi eksik, dengesiz veya çarpık veri gibi temsil sorunlarına karşılık gelir.",
              "b": "Yanlış. Veri hattını etkileyen güvenlik ihlalleri ve kontrolsüz değişiklikler veri hattı testiyle eşleşir; veri seti kısıt testi veri setinin kurallara uygunluğunu sınar.",
              "c": "Doğru. Zayıf etiketleme yönergeleri, belirsiz veri ve zayıf etiketleme kaynaklı yanlış veya tutarsız etiketler, tabloda etiket doğruluğu testiyle eşleştirilir.",
              "d": "Yanlış. Eğitim verisindeki hatalardan doğan yanlılığın karşılığı yanlılık testidir; veri kaynağı izlenebilirliği testi güvenilmez kaynaktan edinilen veriyle eşleşir."
            }
          }
        },
        "en": {
          "stem": "Which of the following pairs an input data risk with the test approach that the syllabus table of input data risks lists for it?",
          "options": [
            {
              "id": "a",
              "text": "Internally inconsistent dataset: data representativeness testing"
            },
            {
              "id": "b",
              "text": "Security breaches or uncontrolled changes affecting the data pipeline: dataset constraint testing"
            },
            {
              "id": "c",
              "text": "Poor annotation leading to inaccurate or inconsistent labels: label correctness testing"
            },
            {
              "id": "d",
              "text": "Bias caused by defects in the training data: data provenance testing"
            }
          ],
          "rationale": {
            "summary": "In the table, poor labelling guidelines and poor annotation map to label correctness testing. In each other option the risk is paired with an approach listed for a different risk.",
            "byOption": {
              "a": "Incorrect. For an internally inconsistent dataset the table lists dataset constraint testing; data representativeness testing maps to representation problems such as imbalanced, skewed or missing data.",
              "b": "Incorrect. Security breaches and uncontrolled changes affecting the pipeline map to data pipeline testing; dataset constraint testing checks whether the data satisfies predefined rules.",
              "c": "Correct. Poor labelling guidelines, ambiguous data and poor annotation leading to inaccurate or inconsistent labels are paired with label correctness testing in the table.",
              "d": "Incorrect. Bias from defects in the training data maps to testing for bias; data provenance testing is listed for data from untrustworthy sources."
            }
          }
        }
      }
    },
    {
      "id": "ctai-0055",
      "revision": 1,
      "syllabusVersion": "2.0",
      "chapter": 5,
      "section": "5.1",
      "syllabusRef": "§5.1.2",
      "objectives": [
        "AI-5.1.2"
      ],